{
  "schema": "shiftory.benchmark-agent-quality-agent-run/v1",
  "case_id": "context-limited-helper-call",
  "candidate_id": "captured_config_b",
  "provider": "google (via GitHub Copilot CLI sub-agent)",
  "model": {
    "name": "gemini-3.7-flash",
    "version": "unknown"
  },
  "agent_tool_version": "copilot-cli-1.0.80",
  "evaluation_protocol": "Fresh, stateless GitHub Copilot CLI sub-agent (task tool, agent_type=general-purpose) given only this materialized prompt package directory (regenerated after fixing a case.json description leak) and instructed to run shiftory explain --graphora off against the fixture repository, follow SKILL.md, and write its final verified explanation verbatim to RAW_RESPONSE.",
  "prompt_package_manifest": [
    {
      "path": "INSTRUCTIONS.md",
      "sha256": "fcaedece84911bea6217bea59923cf5a85f0861897d3f74d4c998e8317908fa9"
    },
    {
      "path": "SKILL.md",
      "sha256": "0f7ddbe349e93b68924c2665f06e015114130083841702ce14c8c650b99c5be0"
    },
    {
      "path": "case.json",
      "sha256": "daa91cd212f41e3460105a11a3d4ffa6934ab5a4ec3901ec61b07077fb20ba40"
    },
    {
      "path": "repository/orders.py",
      "sha256": "c10064e15f95ad36d6f369e3159c0e6a8e4edb560ce41d89ce0db4a99b30b5b3"
    }
  ],
  "prompt_package_digest": "8704c87091b479ba8ca36a841f0c697e120c96b70354b9b54af8359f5c238071",
  "evidence_sha256": "200be92cd2ce24f5e2e01156282f42f2dbc46cad554f93652a3358a0a63d27eb",
  "shiftory_commit": "f4e1a03630bb650be1c6477837a733a4f9f6420e",
  "command_argv": [],
  "env_allowlist": [],
  "generator_access_profile": {
    "repository_access": true,
    "filesystem_scope": "Runs in the same Copilot CLI environment as the orchestrating session; has general bash/file-system tool access and was instructed, but not sandboxed, to stay within the prompt package directory.",
    "network_access": false,
    "tool_access": [
      "bash",
      "view",
      "edit",
      "grep",
      "glob"
    ]
  },
  "isolation_method": "protocol",
  "raw_response_sha256": "ec6a3f466d08b8bd358049c2f1b68700e1a3b4e842bef1463bb439a09a329eb2",
  "raw_response_bytes": 1496,
  "stdout_sha256": null,
  "stderr_sha256": null,
  "truncated": false,
  "timed_out": false,
  "exit_status": null,
  "started_at_utc": "2026-09-02T03:00:30.683123+00:00",
  "finished_at_utc": "2026-09-02T03:00:30.683126+00:00"
}
